<?xml version="1.0" encoding="UTF-8"?>
<configuration xmlns:xsi="http://www.w3.org/2001/XMLSchema-instance"
    xsi:noNamespaceSchemaLocation="http://www.appliedindustriallogic.com/schemas/Configuration-1.0.xsd">
    <name>IBA/PIBA Professional Indemnity</name>
    <timeout>-1</timeout>
    <who>Applied Industrial Logic</who>
    <version>1.0</version>
    <manager>com.ail.core.product.resetproduct.ResetProductService</manager>
    <parentNamespace>AIL.Base.Registry</parentNamespace>

    <types>

        <service name="CalculatePolicyTaxRule" builder="CachingClassBuilder" key="com.ail.core.command.JaninoAccessor">
            <parameter name="Url">~/Rules/CalculatePolicyTaxRule.java</parameter>
        </service>

        <service name="AssessPolicyRiskRule" builder="CachingClassBuilder" key="com.ail.core.command.DroolsDecisionTableAccessor">
            <!--uncomment the following parameter to get a full dump of the rules (drl) and rule facts written to -->
            <!--the console during risk assessment                                                                -->
            <!--parameter name="LoggingIndicatorAsString">FULL</parameter-->
            <parameter name="Url">~/Rules/PolicyRating.xls</parameter>
        </service>

        <command name="AssessSectionRisk/Section" key="com.ail.insurance.quotation.AssessSectionRiskCommandImpl">
            <!-- There are no risk assessment rules at the section level for this product, all risk assessment -->
            <!-- is done at the policy level. The NullService has the effect of saying 'do nothing'.           -->
            <parameter name="Service">com.ail.core.NullService</parameter>
        </command>

        <type name="Policy" builder="CastorXMLBuilder" key="com.ail.insurance.policy.Policy">
            <parameter name="extends">super.Policy</parameter>
            <parameter name="Url">~/Model/Policy.xml</parameter>
        </type>

        <type name="QuotationPageFlow" builder="CastorXMLBuilder" singleInstance="true" key="com.ail.pageflow.PageFlow">
            <parameter name="extends">super.QuotationPageFlow</parameter>
            <parameter name="Url">~/PageFlows/QuotationPageFlow.xml</parameter>
        </type>

        <type name="QuotationDocument" builder="CastorXMLBuilder" singleInstance="true" key="com.ail.core.document.model.DocumentDefinition">
            <parameter name="Url">~/Documents/QuotationDocument.xml</parameter>
        </type>

        <service name="ConditionsSetupService" builder="CachingClassBuilder" key="com.ail.core.command.JaninoAccessor">
            <parameter name="Url">~/JavaServices/ConditionsSetupService.java</parameter>
        </service>

        <command name="ConditionsSetup" key="com.ail.pageflow.ExecutePageActionCommandImpl">
            <parameter name="Service">ConditionsSetupService</parameter>
        </command>

        <service name="ApplyAgentPremiumService" builder="CachingClassBuilder" key="com.ail.core.command.JaninoAccessor">
            <parameter name="Url">~/JavaServices/ApplyAgentPremiumService.java</parameter>
        </service>

        <command name="ApplyAgentPremium" key="com.ail.pageflow.ExecutePageActionCommandImpl">
            <parameter name="Service">ApplyAgentPremiumService</parameter>
        </command>

        <service name="PlaceOrderService" builder="CachingClassBuilder" key="com.ail.core.command.JaninoAccessor">
            <parameter name="Url">~/JavaServices/PlaceOrderService.java</parameter>
        </service>

        <command name="PlaceOrder" key="com.ail.pageflow.ExecutePageActionCommandImpl">
            <parameter name="Service">PlaceOrderService</parameter>
        </command>
        
        <service name="QuoteSetupService" builder="CachingClassBuilder" key="com.ail.core.command.JaninoAccessor">
            <parameter name="Url">~/JavaServices/QuoteSetupService.java</parameter>
        </service>

        <command name="QuoteSetup" key="com.ail.pageflow.ExecutePageActionCommandImpl">
            <parameter name="Service">QuoteSetupService</parameter>
        </command>
        
        <service name="ValidateCompanyDetailsService" builder="CachingClassBuilder" key="com.ail.core.command.JaninoAccessor">
            <parameter name="Url">~/JavaServices/ValidateCompanyDetailsService.java</parameter>
        </service>

        <command name="ValidateCompanyDetails" key="com.ail.pageflow.ExecutePageActionCommandImpl">
            <parameter name="Service">ValidateCompanyDetailsService</parameter>
        </command>
    </types>
</configuration>

