<?xml version="1.0" encoding="UTF-8"?>
<!--
 This file defines the default (factory) configuration use by ListProducts service.
 The configuration defines the products that are know to the system.
-->
<configuration xmlns:xsi="http://www.w3.org/2001/XMLSchema-instance" 
               xsi:noNamespaceSchemaLocation="http://www.appliedindustriallogic.com/schemas/Configuration-1.0.xsd">
    <name>ProductCatalog configuration</name>
    <timeout>60000</timeout>
    <who>factory</who>
    <version>$Revision: 1.2 $</version>
    <manager>com.ail.core.product.listproducts.ListProductsService</manager>
    
    <group name="products">
        <parameter name="com.ail.core.product.TestProduct01"/>
        <parameter name="com.ail.core.product.TestProduct02"/>
        <parameter name="com.ail.core.product.TestProduct03"/>
        <parameter name="com.ail.core.product.TestProduct04"/>
        <parameter name="com.ail.core.product.TestProduct05"/>
        <parameter name="com.ail.core.product.TestProduct06"/>
        <parameter name="com.ail.core.product.TestProduct07"/>
        <parameter name="com.ail.core.product.TestProduct08"/>
        <parameter name="com.ail.core.product.TestProduct09"/>
        <parameter name="com.ail.core.product.TestProduct10"/>
        <parameter name="com.ail.core.product.TestProduct11"/>
        <parameter name="com.ail.core.product.TestProduct12"/>
    </group>
</configuration>
