<?xml version="1.0" encoding="UTF-8"?>
<!--
 This file defines a test product which will always has two referrals.
-->
<configuration xmlns:xsi="http://www.w3.org/2001/XMLSchema-instance" 
               xsi:noNamespaceSchemaLocation="http://www.appliedindustriallogic.com/schemas/Configuration-1.0.xsd">
    <name>Configuration for Test Product 12</name>
    <timeout>60000</timeout>
    <who>factory</who>
    <version>1.0</version>
    <manager>com.ail.core.product.resetproduct.ResetProductService</manager>
    <parentNamespace>com.ail.core.product.TestProduct04.Registry</parentNamespace>
    
    <types>
        <service name="PolicyRule" key="com.ail.core.command.BeanShellAccessor" >
            <parameter name="Script"><![CDATA[
                import com.ail.financial.CurrencyAmount;
                import com.ail.financial.Currency;
                import com.ail.util.Rate;
                import com.ail.insurance.policy.*;
                
                /* get hold of the as */
                as=args.getAssessmentSheetArgRet();
                
                as.addLine(new FixedSum("base premium", "lookup", null, null, new CurrencyAmount("100.00", Currency.GBP)));
                as.addLine(new RateBehaviour("rateA", null, null, "net premium", "base premium", BehaviourType.LOAD, new Rate("10%")));
                as.addLine(new RateBehaviour("rateB", null, null, "net premium", "base premium", BehaviourType.LOAD, new Rate("10%")));
            ]]></parameter>
        </service>

        <type name="TestProduct12" key="com.ail.core.Type" builder="BeanShellBuilder">
            <parameter name="Extends">TestProduct04</parameter>
            <parameter name="Script"><![CDATA[
                type=new com.ail.insurance.policy.Policy();
                type.setProductTypeId("com.ail.core.product.TestProduct12");
            ]]></parameter>
        </type>
    </types>
</configuration>
